{
  "id": 114,
  "name": "Level 114",
  "width": 9,
  "height": 8,
  "music": "stage-bgm-3",
  "clearMusic": "stage-clear-2",
  "startPosition": {
    "x": 0,
    "y": 0
  },
  "tiles": [
    "000001060",
    "000D0C009",
    "00D06C000",
    "0B060A000",
    "00900C000",
    "1ACA11000",
    "900000000",
    "070000000"
  ],
  "entities": [
    {
      "type": "woodstock",
      "x": 8,
      "y": 0
    },
    {
      "type": "woodstock",
      "x": 2,
      "y": 3
    },
    {
      "type": "woodstock",
      "x": 4,
      "y": 3
    },
    {
      "type": "woodstock",
      "x": 0,
      "y": 7
    },
    {
      "type": "ball",
      "x": 8,
      "y": 6,
      "vx": -1,
      "vy": -1
    },
    {
      "type": "portal",
      "x": 2,
      "y": 2,
      "destinationX": 8,
      "destinationY": 7,
      "hidden": true,
      "blockX": 2,
      "blockY": 2
    },
    {
      "type": "powerup",
      "x": 2,
      "y": 2,
      "powerType": "invincible",
      "hidden": true,
      "blockX": 2,
      "blockY": 2,
      "targets": {
        "up": { "x": 6, "y": 2 },
        "down": { "x": 6, "y": 2 },
        "left": { "x": 6, "y": 2 },
        "right": { "x": 6, "y": 2 }
      }
     },
    {
      "type": "spike",
      "x": 7,
      "y": 6
    }
  ]
}
