{
  "id": 7,
  "name": "Final Show",
  "width": 9,
  "height": 8,
  "music": "stage-bgm-8",
  "clearMusic": "stage-clear-8",
  "startPosition": {
    "x": 4,
    "y": 6
  },
  "tiles": [
    "040333050",
    "067000700",
    "000020000",
    "088000800",
    "050333040",
    "000000000",
    "000000000",
    "000000000"
  ],
  "entities": [
    {
      "type": "woodstock",
      "x": 4,
      "y": 1
    },
    {
      "type": "woodstock",
      "x": 2,
      "y": 3
    },
    {
      "type": "woodstock",
      "x": 6,
      "y": 3
    },
    {
      "type": "woodstock",
      "x": 4,
      "y": 5
    },
    {
      "type": "ball",
      "x": 2,
      "y": 2,
      "vx": 1,
      "vy": 1
    },
    {
      "type": "ball",
      "x": 6,
      "y": 2,
      "vx": -1,
      "vy": 1
    },
    {
      "type": "ball",
      "x": 4,
      "y": 4,
      "vx": 1,
      "vy": -1
    },
    {
      "type": "powerup",
      "x": 1,
      "y": 6,
      "powerType": "invincible"
    },
    {
      "type": "powerup",
      "x": 7,
      "y": 6,
      "powerType": "speed"
    }
  ]
}
