{
  "id": 16,
  "name": "Level 16",
  "width": 9,
  "height": 8,
  "music": "stage-bgm-4",
  "clearMusic": "stage-clear-4",
  "startPosition": {
    "x": 4,
    "y": 4
  },
  "tiles": [
    "080000010",
    "1E00E00E9",
    "006777700",
    "006000800",
    "006000800",
    "009999800",
    "7E00E00E1",
    "010000060"
  ],
  "entities": [
    {
      "type": "woodstock",
      "x": 0,
      "y": 0
    },
    {
      "type": "woodstock",
      "x": 8,
      "y": 0
    },
    {
      "type": "woodstock",
      "x": 0,
      "y": 7
    },
    {
      "type": "woodstock",
      "x": 8,
      "y": 7
    },
    {
      "type": "ball",
      "x": 4,
      "y": 0,
      "vx": -1,
      "vy": -1
    }
  ]
}
