{
  "id": 53,
  "name": "Level 53",
  "width": 9,
  "height": 8,
  "music": "stage-bgm-6",
  "clearMusic": "stage-clear-5",
  "startPosition": {
    "x": 4,
    "y": 7
  },
  "tiles": [
    "008000800",
    "0180008D0",
    "77A000199",
    "000000000",
    "000000000",
    "77D000B99",
    "0C6000610",
    "006000600"
  ],
  "entities": [
    {
      "type": "woodstock",
      "x": 0,
      "y": 0
    },
    {
      "type": "woodstock",
      "x": 8,
      "y": 0
    },
    {
      "type": "woodstock",
      "x": 0,
      "y": 7
    },
    {
      "type": "woodstock",
      "x": 8,
      "y": 7
    },
    {
      "type": "ball",
      "x": 1,
      "y": 0,
      "vx": 1,
      "vy": 1
    },
    {
      "type": "ball",
      "x": 7,
      "y": 7,
      "vx": 1,
      "vy": 1
    },
    {
      "type": "portal",
      "x": 2,
      "y": 5,
      "destinationX": 8,
      "destinationY": 1,
      "hidden": true,
      "blockX": 2,
      "blockY": 5
    },
    {
      "type": "powerup",
      "x": 1,
      "y": 6,
      "powerType": "time",
      "hidden": true,
      "blockX": 1,
      "blockY": 6,
      "targets": {
        "up": { "x": 0, "y": 4 },
        "down": { "x": 0, "y": 4 },
        "left": { "x": 0, "y": 4 },
        "right": { "x": 0, "y": 4 }
      }
    }
  ]
}
