{
  "id": 66,
  "name": "Level 66",
  "width": 9,
  "height": 8,
  "music": "stage-bgm-7",
  "clearMusic": "stage-clear-6",
  "startPosition": {
    "x": 4,
    "y": 4
  },
  "tiles": [
    "0000E0000",
    "000101000",
    "011000110",
    "E0000000E",
    "E0000000E",
    "011000110",
    "000101000",
    "0000E0000"
  ],
  "entities": [
    {
      "type": "woodstock",
      "x": 0,
      "y": 0
    },
    {
      "type": "woodstock",
      "x": 8,
      "y": 0
    },
    {
      "type": "woodstock",
      "x": 0,
      "y": 7
    },
    {
      "type": "woodstock",
      "x": 8,
      "y": 7
    },
    {
      "type": "ball",
      "x": 1,
      "y": 0,
      "vx": 1,
      "vy": -1
    },
    {
      "type": "ball",
      "x": 6,
      "y": 6,
      "vx": 1,
      "vy": 1
    },
    {
      "type": "spike",
      "x": 5,
      "y": 0
    }
  ]
}
