{
  "id": 116,
  "name": "Level 116",
  "width": 9,
  "height": 8,
  "music": "stage-bgm-10",
  "clearMusic": "stage-clear-9",
  "startPosition": {
    "x": 3,
    "y": 4
  },
  "tiles": [
    "000000000",
    "111000111",
    "000B0A000",
    "0000D0000",
    "000010000",
    "000B0A000",
    "111000111",
    "000000000"
  ],
  "entities": [
    {
      "type": "woodstock",
      "x": 8,
      "y": 0
    },
    {
      "type": "woodstock",
      "x": 2,
      "y": 2
    },
    {
      "type": "woodstock",
      "x": 6,
      "y": 5
    },
    {
      "type": "woodstock",
      "x": 0,
      "y": 7
    },
    {
      "type": "ball",
      "x": 4,
      "y": 7,
      "vx": -1,
      "vy": -1
    },
    {
      "type": "powerup",
      "x": 5,
      "y": 2,
      "powerType": "time",
      "hidden": true,
      "blockX": 5,
      "blockY": 2,
      "targets": {
        "up": { "x": 6, "y": 0 },
        "down": { "x": 6, "y": 0 },
        "left": { "x": 6, "y": 0 },
        "right": { "x": 6, "y": 0 }
      }
    },
    {
      "type": "spike",
      "x": 0,
      "y": 0
    }
  ]
}
